url,title,date,publisher,content
http://xinghuo.njit.edu.cn/info/1011/12699.htm,我校组织人员在线参加《习近平总书记教育重要论述讲义》使用培训,2020-11-26,党委宣传部,11月23—24日，《习近平总书记教育重要论述讲义》（以下简称《讲义》）使用培训在京举行，我校在至勤楼•行政中心多功能厅设立分会场。党委副书记濮励杰，党委常委、副院长郑锋，相关职能部门负责人，讲授“习近平总书记关于教育的重要论述”相关内容的马克思主义理论学科教师和“形势与政策”课教师代表参加了分会场同步直播培训。
http://xinghuo.njit.edu.cn/info/1011/12693.htm,由《致加西亚的信》说开去——史国君书记为院长（主任）助理讲授如何提升执行力,2020-11-25,党委组织部,11月24日下午，党委书记史国君主持召开我校第二次院长（主任）助理读书分享交流会，这是继《卓有成效的管理者》暑期读书分享会后，史书记为各位院长（主任）助理们定制的又一“精神大餐”，为筑牢青年干部精神根基、推进能力全面发展持续助力。
http://xinghuo.njit.edu.cn/info/1011/12690.htm,中国机械工业教育协会理事长王守法一行来我校调研,2020-11-25,党委办公室、校长办公室,11月21日，中国机械工业教育协会理事长、原北京工业大学党委书记王守法，中国机械工业教育协会秘书长高群苓一行来我校调研。党委副书记、院长史金飞，党委常委、副院长杨征宇接待了来宾。
http://xinghuo.njit.edu.cn/info/1011/12688.htm,我校召开“十四五”事业发展规划编制工作汇报会,2020-11-24,发展与对外合作处,11月24日上午，我校在至勤楼•行政中心北303会议室召开“十四五”事业发展规划编制工作汇报会。“十四五”事业发展规划编制工作领导小组组长、校党委书记史国君，组长、校党委副书记、院长史金飞，副组长、校党委常委、副院长张仰飞出席会议，11个专项规划编制小组牵头部门主要负责人参加会议。
http://xinghuo.njit.edu.cn/info/1011/12680.htm,南京市2020年度创业大讲坛在我校举办专场活动,2020-11-24,学生工作处,11月21日下午，南京市2020年度创业大讲坛南京工程学院专场暨第七届“众创梦想 天印启航”校园见习月活动启动仪式在我校天健苑·体育中心举行。活动在南京市人力资源和社会保障局指导下，由南京市职业技术培训指导中心主办，我校和南京市华普赢之道职业培训学校联合承办。
http://xinghuo.njit.edu.cn/info/1011/12663.htm,省委第六巡视组巡视南京工程学院党委工作动员会召开,2020-11-20,,根据省委关于巡视工作的统一部署，2020年11月19日，省委第六巡视组巡视南京工程学院党委工作动员会召开。会前，省委第六巡视组组长陈荣桂主持召开与南京工程学院党委书记史国君，院党委副书记、院长史金飞的见面沟通会，传达学习了省委书记娄勤俭同志近期关于巡视工作讲话精神，通报了有关工作安排。会上，陈荣桂作了动员讲话，对做好巡视工作提出要求。史国君主持会议并作表态发言。
http://xinghuo.njit.edu.cn/info/1011/12662.htm,南京市嘉兴商会&中国EDP教育联盟江苏校友会来我校举办专场招聘会,2020-11-19,学生工作处,11月18日下午，我校在至馨苑·综合服务楼二楼大学生活动中心举办南京市嘉兴商会&中国EDP教育联盟江苏校友会南京工程学院专场校园招聘会，这是我校“高校+商会+企业”就业服务新模式的又一次有益尝试。
http://xinghuo.njit.edu.cn/info/1011/12660.htm,快乐运动 合力抗疫——我校举办教职工“最美校园健身行”活动,2020-11-19,校工会,11月18日下午，天高云淡，初冬的暖阳普照大地，天印湖畔的校园叠翠流金，我校教职工“最美校园健身行”活动在天健苑·体育中心广场拉开帷幕。党委书记史国君为“健身行”活动鸣枪发令。党委副书记濮励杰为活动致辞。党委常委、副院长朱晓春、张仰飞出席开幕式。全校24个分工会1700余名教职工在各单位旗手引导下，在美丽的天印湖畔沐浴阳光、大步前进。
http://xinghuo.njit.edu.cn/info/1011/12659.htm,翰墨丹青颂廉洁——我校举办“天印清风颂”廉政文化建设师生书画展,2020-11-18,纪委办公室,11月18日上午，由校纪委、工会、团委、离退休工作处、图书馆等部门联合举办的“天印清风颂”廉政文化建设师生书画展在图书馆艺术长廊开幕。
http://xinghuo.njit.edu.cn/info/1011/12648.htm,第五届江苏省科协青年会员创新创业大赛​装备制造领域决赛在我校举办,2020-11-16,学生工作处,11月14日，第五届江苏省科协青年会员创新创业大赛装备制造领域决赛在我校天印会议中心学术报告厅举办。本次大赛以“点燃梦想 创赢未来”为主题，由江苏省科学技术协会主办，我校和南京江宁高新区管委会、江苏省机械工程学会、江苏省学会服务中心、南京市江宁区科协等单位联合承办。校党委常委、副院长朱晓春，江苏省科学技术协会秘书长周景山，江苏省学会服务中心主任马立涛，江苏省科协学会部调研员岳智顺，南京市江宁区科协主席黄正勇，南京江宁高新技术产业开发区副总经理孔永祥，江苏省机械工程学会副秘书长饶华球，校科技与产业处、学生工作处相关负责人及参赛选手、观摩师生、媒体代表等共300余人参与了活动。
http://xinghuo.njit.edu.cn/info/1011/12641.htm,张仰飞副院长赴校友企业仁创科技集团落实深度合作,2020-11-14,发展与对外合作处,11月12-13日，党委常委、副院长张仰飞前往北京，拜访我校优秀校友、北京校友联谊会会长秦升益，与其创办企业——仁创科技集团部分高管和硅砂资源利用国家重点实验室具体负责人等，就推动落实校企实质性合作事宜进行了卓有成效的交流，并达成了一致意见。
http://xinghuo.njit.edu.cn/info/1011/12612.htm,学校党委全面启动第四轮巡察工作,2020-11-12,纪委,根据学校党委巡察工作统一部署，11月11日下午，校党委第四轮巡察进驻动员部署大会在至勤楼·行政中心多功能厅举行。校党委书记、巡察工作领导小组组长史国君，校党委副书记、副院长、第一巡察组组长曹雪虹，校党委副书记、第二巡察组组长濮励杰，校党委常委、纪委书记、巡察办主任赵立法，校党委常委、组织部部长朱松青，校纪委副书记程国方出席会议。巡察组全体成员，6家被巡察单位教职工代表以及上一届领导班子成员参加了会议。会议由赵立法主持。
http://xinghuo.njit.edu.cn/info/1011/12606.htm,学校各教育教学单位党政负责人参加全省高校院（系）党政负责人专题视频培训班,2020-11-11,党委组织部,11月10日上午，省委教育工委召开全省高校院（系）党政负责人专题视频培训会，深入学习贯彻习近平新时代中国特色社会主义思想和习近平总书记关于教育的重要论述，学习宣传党的十九届五中全会精神，进一步武装思想、提高站位、凝聚共识，全面提升高校院（系）党建工作质量水平。我校党委副书记濮励杰，党委组织部、统战部相关负责人及各教育教学单位党政负责人参加了专题视频培训班。
http://xinghuo.njit.edu.cn/info/1011/12602.htm,我校学生作品在第七届“紫金奖·建筑及环境设计大赛”中获得一、二等奖,2020-11-10,建筑工程学院,
http://xinghuo.njit.edu.cn/info/1011/12590.htm,我校举行第十三批科技镇长团成员座谈会,2020-11-09,党委组织部,11月6日下午，我校召开第十三批科技镇长团挂职成员交流座谈会。校党委书记史国君出席会议并讲话。党委常委、副院长朱晓春，第十三批科技镇长团及扶贫工作队挂职成员等参加会议。党委常委、党委组织部、党委统战部部长朱松青主持会议。
http://xinghuo.njit.edu.cn/info/1011/12589.htm,共青团江苏省委书记司勇一行来我校调研考察,2020-11-09,校团委,11月8日上午，共青团江苏省委书记司勇一行来我校就创新创业教育和大学生就业工作进行调研考察。校党委书记史国君，党委常委、副院长张仰飞陪同考察。
http://xinghuo.njit.edu.cn/info/1011/12591.htm,传承恩来精神，忠诚履责尽责​——校纪检干部参观周恩来纪念馆,2020-11-09,校纪委,根据省纪委开展“学恩来精神、守初心使命”专题教育活动要求，11月6日，校纪委书记赵立法带领校纪委委员、二级基层党组织纪检委员、校纪委机关全体人员、机关党委第九支部全体党员在周恩来总理家乡淮安开展现场学习，集体瞻仰周恩来纪念馆，接受周恩来精神熏陶教育。
http://xinghuo.njit.edu.cn/info/1011/12587.htm,我校召开共青团第三次代表大会、第六次学生代表大会,2020-11-09,校团委,11月8日上午，共青团南京工程学院第三次代表大会、第六次学生代表大会在我校科创园天印会议中心学术报告厅举行。团省委书记司勇、团省委组织部部长陈文娟、高校工作部部长付建龙，省学联驻会主席伏超；我校党委书记史国君，党委副书记、院长史金飞，校党委常委、副院长张仰飞，南京大学团委书记蔡颖蔚，学校党群部门主要负责人，各学院党委副书记以及全体青年代表、列席代表等300余人出席会议。
http://xinghuo.njit.edu.cn/info/1011/12601.htm,常熟市古里镇与我校深入推进“校、地、企”产学研合作,2020-11-08,科技与产业处,11月4日，常熟市古里镇党委书记谈晓华、常熟团市委书记刘飞一行来我校洽谈合作。我校党委常委、副院长朱晓春出席座谈会并讲话。科技与产业处、机械工程学院、自动化学院等部门和学院相关负责人与会。
http://xinghuo.njit.edu.cn/info/1011/12584.htm,用青春拼搏 为梦想冲刺——我校第十六届运动会鸣金开锣,2020-11-06,党委宣传部,"冲锋号角随风起，田径健儿赛秋高。11月6日-7日，我校迎来第十六届运动会，体育公园和天健苑•体育中心彩旗飘扬，欢声雷动,千百个师生相约体育场为运动会喝彩、为运动健儿加油。"
http://xinghuo.njit.edu.cn/info/1011/12582.htm,史国君书记为我校百岁老人贺寿,2020-11-06,离退休工作处,11月5日上午，校党委书记史国君，党委副书记、副院长曹雪虹特地来到位于北京西路76号我校退休老教师曹纬文家中，共同为老人家庆祝一百岁期颐生日。为百岁老人祝寿，是我校的传统敬老活动，也是我校贯彻落实中共江苏省委关于开展2020年敬老日活动的具体举措。
http://xinghuo.njit.edu.cn/info/1011/12571.htm,学校召开党风廉政建设工作协调会,2020-11-06,纪委办公室,11月5日上午，学校党风廉政建设和反腐败工作协调小组相关成员单位召开联席会议，认真传达学习上级纪委和学校党委有关会议及文件精神，研究贯彻落实我校党风廉政建设协调机制，并就各部门梳理移送相关问题信息，协同做好学校第四轮巡察准备工作等作出具体部署。校党委常委、纪委书记赵立法主持会议，学校党办校办、组织、宣传、人事、财务、审计、纪委等党风廉政建设和反腐败工作协调小组各成员单位负责同志参加会议。
http://xinghuo.njit.edu.cn/info/1011/12564.htm,【校际交流】山东交通学院党委委员、副校长姜华平一行来我校调研,2020-11-05,国际合作与交流处,11月5日上午，山东交通学院党委委员、副校长姜华平一行来我校调研考察并进行座谈。我校党委副书记濮励杰接待了来访嘉宾。
http://xinghuo.njit.edu.cn/info/1011/12560.htm,我校举办“中西天籁”中美艺术家声乐精粹讲坛音乐会,2020-11-05,校团委,11月3日晚，由江苏省教育厅、财政厅主办的2020年高雅艺术进校园拓展项目——“中西天籁”中美艺术家声乐精粹讲坛音乐会在我校嘉悦•印湖会议中心举办。校党委常委、副院长张仰飞，部分职能部门负责人、教师代表与400余名学生共同观看了演出。
http://xinghuo.njit.edu.cn/info/1011/12558.htm,【校际交流】浙江海洋大学党委副书记叶舟一行来我校调研,2020-11-04,学生工作处,11月4日上午，浙江海洋大学党委副书记叶舟一行来我校调研考察并进行座谈。我校党委常委、副院长张仰飞接待了来访嘉宾，学生工作处、校团委、信息与通信工程学院等相关部门负责人参加了座谈会。
http://xinghuo.njit.edu.cn/info/1011/12550.htm,用雨花英烈精神为青年补“钙”——史国君书记带领国教院学子走进雨花台,2020-11-03,国际教育学院,六朝雨花凝天地，一部青史铸千秋。11月1日下午，校党委书记史国君以“第二班主任”的身份带领软工（中外）201、202团支部全体共青团员，来到雨花台烈士陵园，开展以“弘扬雨花英烈精神，忆苦思甜筑梦青春”为主题的团日活动，追溯红色历史、缅怀革命先烈。
http://xinghuo.njit.edu.cn/info/1011/12544.htm,我校党委理论学习中心组认真传达学习十九届五中全会精神,2020-11-03,党委宣传部,11月2日下午，我校党委理论学习中心组在至勤楼•行政中心303会议室举行本学期第七次学习会，认真传达学习党的第十九届五中全会精神，全面部署全校学习贯彻全会精神工作。会议由党委书记史国君主持，党委常委、两委委员、二级基层党组织负责人参加学习交流。
http://xinghuo.njit.edu.cn/info/1011/12527.htm,我校召开后勤工作专题会,2020-10-30,后勤保障处,10月28日下午，我校在至勤楼·行政中心北303会议室召开后勤工作专题会议，党委常委、副院长郑锋出席会议并作工作部署。
http://xinghuo.njit.edu.cn/info/1011/12513.htm,我校举行2021年国家自然科学基金申报组织动员会,2020-10-29,科技与产业处,为做好2021年国家自然科学基金申报工作，10月28日上午，我校在至勤楼•行政中心北303会议室召开2021年国家自然科学基金申报动员会。党委常委、副院长朱晓春出席本次申报组织动员会并讲话，各二级单位分管科研工作负责人参加了会议。
http://xinghuo.njit.edu.cn/info/1011/12502.htm,我校自动化专业接受工程教育专业认证现场考查,2020-10-28,自动化学院 教务处,10月26—27日，以湘潭大学段斌教授为组长的中国工程教育专业认证专家组一行来到我校，对自动化专业进行现场考查。专家组成员还包括上海交通大学蔡云泽教授、深圳博科系统科技有限公司高君教授和专家组秘书、福建师范大学杨欣伟。
http://xinghuo.njit.edu.cn/info/1011/12503.htm,江苏省企业发展工程协会来我校调研大学生创业工作,2020-10-28,学工处,10月26日下午，江苏省企业发展工程协会副会长兼秘书长姚志勇、副会长南京农业大学工学院院长汪小旵一行来我校调研大学生创业工作。我校党委常委、副院长张仰飞接待了来宾。
http://xinghuo.njit.edu.cn/info/1011/12493.htm,全省火力发电集控运行值班员技能“大比武”在我校拉开帷幕,2020-10-27,能源与动力工程学院 党委宣传部,10月27日上午，由江苏省总工会、江苏省人社厅、江苏省电力行业协会主办的江苏省火力发电集控运行值班员技能竞赛在我校正式拉开帷幕。
http://xinghuo.njit.edu.cn/info/1011/12492.htm,军委国防动员部动员征集局领导来我校检查指导征兵工作,2020-10-27,人武部,10月26日下午，军委国防动员部动员征集局副局长郑勇大校莅临我校检查指导征兵工作。我校党委常委、副院长张仰飞出席并致欢迎辞，人武部负责人、负责征兵工作辅导员和退役大学生士兵代表参加了此次检查汇报会。
http://xinghuo.njit.edu.cn/info/1011/12495.htm,我校召开2020年体育运动委员会会议,2020-10-27,教务处,10月23日上午，学校在至勤楼•行政中心北305会议室召开2020年校体育运动委员会会议，校体育运动委员会全体委员参加了本次会议。会议通报了2019/2020学年学校体育教育和体育运动工作情况；研究了存在问题，明确了新学年相关工作目标和要点；部署了我校第十六届运动会的组织工作。党委常委、校体育运动委员会主任郑锋副院长出席会议并讲话。
http://xinghuo.njit.edu.cn/info/1011/12494.htm,我校组织开展后勤安全工作专项检查,2020-10-27,后勤保障处,10月23日下午，校党委常委、副院长郑锋率教务处、学工处、保卫处、国资处、后勤处、门诊部等部门负责人，就近期后勤安全工作开展情况进行现场检查。
http://xinghuo.njit.edu.cn/info/1011/12591.htm,传承恩来精神，忠诚履责尽责​——校纪检干部参观周恩来纪念馆,2020-11-09,校纪委,根据省纪委开展“学恩来精神、守初心使命”专题教育活动要求，11月6日，校纪委书记赵立法带领校纪委委员、二级基层党组织纪检委员、校纪委机关全体人员、机关党委第九支部全体党员在周恩来总理家乡淮安开展现场学习，集体瞻仰周恩来纪念馆，接受周恩来精神熏陶教育。
http://xinghuo.njit.edu.cn/info/1011/12587.htm,我校召开共青团第三次代表大会、第六次学生代表大会,2020-11-09,校团委,11月8日上午，共青团南京工程学院第三次代表大会、第六次学生代表大会在我校科创园天印会议中心学术报告厅举行。团省委书记司勇、团省委组织部部长陈文娟、高校工作部部长付建龙，省学联驻会主席伏超；我校党委书记史国君，党委副书记、院长史金飞，校党委常委、副院长张仰飞，南京大学团委书记蔡颖蔚，学校党群部门主要负责人，各学院党委副书记以及全体青年代表、列席代表等300余人出席会议。
http://xinghuo.njit.edu.cn/info/1011/12601.htm,常熟市古里镇与我校深入推进“校、地、企”产学研合作,2020-11-08,科技与产业处,11月4日，常熟市古里镇党委书记谈晓华、常熟团市委书记刘飞一行来我校洽谈合作。我校党委常委、副院长朱晓春出席座谈会并讲话。科技与产业处、机械工程学院、自动化学院等部门和学院相关负责人与会。
http://xinghuo.njit.edu.cn/info/1011/12584.htm,用青春拼搏 为梦想冲刺——我校第十六届运动会鸣金开锣,2020-11-06,党委宣传部,"冲锋号角随风起，田径健儿赛秋高。11月6日-7日，我校迎来第十六届运动会，体育公园和天健苑•体育中心彩旗飘扬，欢声雷动,千百个师生相约体育场为运动会喝彩、为运动健儿加油。"
http://xinghuo.njit.edu.cn/info/1011/12582.htm,史国君书记为我校百岁老人贺寿,2020-11-06,离退休工作处,11月5日上午，校党委书记史国君，党委副书记、副院长曹雪虹特地来到位于北京西路76号我校退休老教师曹纬文家中，共同为老人家庆祝一百岁期颐生日。为百岁老人祝寿，是我校的传统敬老活动，也是我校贯彻落实中共江苏省委关于开展2020年敬老日活动的具体举措。
http://xinghuo.njit.edu.cn/info/1011/12571.htm,学校召开党风廉政建设工作协调会,2020-11-06,纪委办公室,11月5日上午，学校党风廉政建设和反腐败工作协调小组相关成员单位召开联席会议，认真传达学习上级纪委和学校党委有关会议及文件精神，研究贯彻落实我校党风廉政建设协调机制，并就各部门梳理移送相关问题信息，协同做好学校第四轮巡察准备工作等作出具体部署。校党委常委、纪委书记赵立法主持会议，学校党办校办、组织、宣传、人事、财务、审计、纪委等党风廉政建设和反腐败工作协调小组各成员单位负责同志参加会议。
http://xinghuo.njit.edu.cn/info/1011/12564.htm,【校际交流】山东交通学院党委委员、副校长姜华平一行来我校调研,2020-11-05,国际合作与交流处,11月5日上午，山东交通学院党委委员、副校长姜华平一行来我校调研考察并进行座谈。我校党委副书记濮励杰接待了来访嘉宾。
http://xinghuo.njit.edu.cn/info/1011/12560.htm,我校举办“中西天籁”中美艺术家声乐精粹讲坛音乐会,2020-11-05,校团委,11月3日晚，由江苏省教育厅、财政厅主办的2020年高雅艺术进校园拓展项目——“中西天籁”中美艺术家声乐精粹讲坛音乐会在我校嘉悦•印湖会议中心举办。校党委常委、副院长张仰飞，部分职能部门负责人、教师代表与400余名学生共同观看了演出。
http://xinghuo.njit.edu.cn/info/1011/12558.htm,【校际交流】浙江海洋大学党委副书记叶舟一行来我校调研,2020-11-04,学生工作处,11月4日上午，浙江海洋大学党委副书记叶舟一行来我校调研考察并进行座谈。我校党委常委、副院长张仰飞接待了来访嘉宾，学生工作处、校团委、信息与通信工程学院等相关部门负责人参加了座谈会。
http://xinghuo.njit.edu.cn/info/1011/12550.htm,用雨花英烈精神为青年补“钙”——史国君书记带领国教院学子走进雨花台,2020-11-03,国际教育学院,六朝雨花凝天地，一部青史铸千秋。11月1日下午，校党委书记史国君以“第二班主任”的身份带领软工（中外）201、202团支部全体共青团员，来到雨花台烈士陵园，开展以“弘扬雨花英烈精神，忆苦思甜筑梦青春”为主题的团日活动，追溯红色历史、缅怀革命先烈。
http://xinghuo.njit.edu.cn/info/1011/12544.htm,我校党委理论学习中心组认真传达学习十九届五中全会精神,2020-11-03,党委宣传部,11月2日下午，我校党委理论学习中心组在至勤楼•行政中心303会议室举行本学期第七次学习会，认真传达学习党的第十九届五中全会精神，全面部署全校学习贯彻全会精神工作。会议由党委书记史国君主持，党委常委、两委委员、二级基层党组织负责人参加学习交流。
http://xinghuo.njit.edu.cn/info/1011/12527.htm,我校召开后勤工作专题会,2020-10-30,后勤保障处,10月28日下午，我校在至勤楼·行政中心北303会议室召开后勤工作专题会议，党委常委、副院长郑锋出席会议并作工作部署。
http://xinghuo.njit.edu.cn/info/1011/12513.htm,我校举行2021年国家自然科学基金申报组织动员会,2020-10-29,科技与产业处,为做好2021年国家自然科学基金申报工作，10月28日上午，我校在至勤楼•行政中心北303会议室召开2021年国家自然科学基金申报动员会。党委常委、副院长朱晓春出席本次申报组织动员会并讲话，各二级单位分管科研工作负责人参加了会议。
http://xinghuo.njit.edu.cn/info/1011/12502.htm,我校自动化专业接受工程教育专业认证现场考查,2020-10-28,自动化学院 教务处,10月26—27日，以湘潭大学段斌教授为组长的中国工程教育专业认证专家组一行来到我校，对自动化专业进行现场考查。专家组成员还包括上海交通大学蔡云泽教授、深圳博科系统科技有限公司高君教授和专家组秘书、福建师范大学杨欣伟。
http://xinghuo.njit.edu.cn/info/1011/12503.htm,江苏省企业发展工程协会来我校调研大学生创业工作,2020-10-28,学工处,10月26日下午，江苏省企业发展工程协会副会长兼秘书长姚志勇、副会长南京农业大学工学院院长汪小旵一行来我校调研大学生创业工作。我校党委常委、副院长张仰飞接待了来宾。
http://xinghuo.njit.edu.cn/info/1011/12493.htm,全省火力发电集控运行值班员技能“大比武”在我校拉开帷幕,2020-10-27,能源与动力工程学院 党委宣传部,10月27日上午，由江苏省总工会、江苏省人社厅、江苏省电力行业协会主办的江苏省火力发电集控运行值班员技能竞赛在我校正式拉开帷幕。
http://xinghuo.njit.edu.cn/info/1011/12492.htm,军委国防动员部动员征集局领导来我校检查指导征兵工作,2020-10-27,人武部,10月26日下午，军委国防动员部动员征集局副局长郑勇大校莅临我校检查指导征兵工作。我校党委常委、副院长张仰飞出席并致欢迎辞，人武部负责人、负责征兵工作辅导员和退役大学生士兵代表参加了此次检查汇报会。
http://xinghuo.njit.edu.cn/info/1011/12495.htm,我校召开2020年体育运动委员会会议,2020-10-27,教务处,10月23日上午，学校在至勤楼•行政中心北305会议室召开2020年校体育运动委员会会议，校体育运动委员会全体委员参加了本次会议。会议通报了2019/2020学年学校体育教育和体育运动工作情况；研究了存在问题，明确了新学年相关工作目标和要点；部署了我校第十六届运动会的组织工作。党委常委、校体育运动委员会主任郑锋副院长出席会议并讲话。
